# name: test/sql/projection/test_row_number.test
# description: Test row number
# group: [projection]

statement ok
PRAGMA enable_verification

statement ok
create table a(i integer);

statement ok
BEGIN

statement ok
insert into a values (42), (44);

query II
SELECT rownum, * FROM a
----
1	42
2	44

statement ok
COMMIT

query II
SELECT rownum, * FROM a
----
1	42
2	44

query II
SELECT rownum, * FROM a WHERE a=44
----
2	44

statement ok
DELETE FROM a WHERE a=42

query II
SELECT rownum, * FROM a WHERE a=44
----
1	44
